{
  "formatVersion": 1,
  "id": "stage02",
  "room": "livingKitchen",
  "seed": 202,
  "playerSpawn": [-370, 120, -290],
  "human": {
    "id": "human",
    "position": [-150, 0, 240],
    "facingYaw": 180,
    "head": "head",
    "shoulders": [[-20, 95, -6], [20, 95, -6]],
    "parts": [
      { "id": "head", "kind": "head", "a": [0, 112, 0], "b": [0, 118, 0], "radius": 10 },
      { "id": "neck", "kind": "neck", "a": [0, 96, -3], "b": [0, 104, -2], "radius": 5, "site": "neck" },
      { "id": "torso", "kind": "torso", "a": [0, 58, -8], "b": [0, 88, -6], "radius": 16 },
      { "id": "upperArmL", "kind": "upperArm", "a": [-20, 95, -6], "b": [-24, 66, -2], "radius": 5 },
      { "id": "forearmL", "kind": "forearm", "a": [-24, 66, -2], "b": [-20, 60, 26], "radius": 4, "site": "forearm" },
      { "id": "upperArmR", "kind": "upperArm", "a": [20, 95, -6], "b": [24, 66, -2], "radius": 5 },
      { "id": "forearmR", "kind": "forearm", "a": [24, 66, -2], "b": [20, 60, 26], "radius": 4, "site": "forearm" },
      { "id": "thighL", "kind": "thigh", "a": [-10, 52, -2], "b": [-10, 52, 40], "radius": 7 },
      { "id": "calfL", "kind": "calf", "a": [-10, 50, 42], "b": [-10, 8, 46], "radius": 5, "site": "calf" },
      { "id": "thighR", "kind": "thigh", "a": [10, 52, -2], "b": [10, 52, 40], "radius": 7 },
      { "id": "calfR", "kind": "calf", "a": [10, 50, 42], "b": [10, 8, 46], "radius": 5, "site": "calf" }
    ],
    "idle": {
      "lookYaws": [0],
      "glance": { "interval": { "min": 6, "max": 10 }, "angle": 60, "duration": 2 }
    },
    "actions": [
      { "name": "shiftSitting", "weight": 3, "duration": 1.5, "motions": [
        { "part": "torso", "offsetA": [0, 0, 2], "offsetB": [3, 2, 4] },
        { "part": "neck", "offsetA": [3, 2, 4], "offsetB": [3, 2, 4] },
        { "part": "head", "offsetA": [3, 2, 4], "offsetB": [3, 2, 4] }
      ] },
      { "name": "crossLegs", "weight": 2, "duration": 1.6, "motions": [
        { "part": "thighL", "offsetA": [0, 0, 0], "offsetB": [12, 8, 0] },
        { "part": "calfL", "offsetA": [12, 8, 0], "offsetB": [16, 18, 4] }
      ] },
      { "name": "grabRemote", "weight": 2, "duration": 1.2, "motions": [
        { "part": "forearmR", "offsetA": [0, 0, 0], "offsetB": [-6, 6, 10] }
      ] },
      { "name": "scratchArm", "weight": 2, "duration": 1.0, "motions": [
        { "part": "forearmL", "offsetA": [0, 0, 0], "offsetB": [4, 4, -6] }
      ] },
      { "name": "stretch", "weight": 1, "duration": 0.8, "motions": [
        { "part": "upperArmL", "offsetA": [0, 0, 0], "offsetB": [-10, 30, 4] },
        { "part": "forearmL", "offsetA": [-10, 30, 4], "offsetB": [-10, 50, 10] },
        { "part": "upperArmR", "offsetA": [0, 0, 0], "offsetB": [10, 30, 4] },
        { "part": "forearmR", "offsetA": [10, 30, 4], "offsetB": [10, 50, 10] }
      ] }
    ],
    "canSpray": false,
    "modifiers": []
  },
  "dripSources": [],
  "humidZones": [],
  "fans": [],
  "webs": [],
  "coils": [],
  "sprayDispensers": [],
  "tutorial": ["visionZones", "frenzyHide", "reactionDodge"]
}
